,text,label2,p,label,is_valid,set_tag,is_test
817,"cioè siccome vedono magari una persona apparentemente, cioè la vedono insomma no apparentemente, che fa una vita normale, che ha un aspetto normale, e quindi secondo me tendenzialmente non percepiscono niente insomma, descrivono la persona come una persona normale;",causa,"('red', 2, 1)",red,False,0.0,False
818,"Ciò contribuisce ad alimentare ulteriormente i motivi del dissidio, nonché a generare confusione ed imprevedibilità nella vita delle minori",causa,"('red', 2, 1)",red,False,0.0,False
819,"questo perche è presente la speranza che le cose possano andare meglio, grazie allo psicologo",causa,"('red', 2, 1)",red,False,0.0,False
820,"Quando un  cittadino  che sfortunatamente chiede un' aiuto di qualsiasi genere alle  amministrazioni  locali, sia per indifferenza o incompetenza fanno di tutto per ostacolarlo, ",causa,"('red', 2, 1)",red,False,0.0,False
821,Tuttavia per quanto mi riguarda non sono stata sufficientemente preparata a quanto sarebbe successo e così non ho avuto il modo migliore per tranquillizzare anche mia figlia che era molto piccola.,causa,"('red', 2, 1)",red,False,0.0,False
822,"soggetto con vuoto interiore, che compromette quasi tutte le attività della vita quotidiana",causa,"('red', 2, 1)",red,False,0.0,False
823,spesso ad alto rischio suicidario per il lutto complicato e la depressione che sopraggiunge.,causa,"('red', 2, 1)",red,False,0.0,False
824,Le uniche lamentele sono che più studenti ci sono e più affollato è il quartiere,causa,"('red', 2, 1)",red,False,0.0,False
825,"ma non ce la faceva perché il suo corpo era paralizzato ,",causa,"('red', 2, 1)",red,True,1.0,False
826,nella quale si era venuta a trovare in seguito all’allontanamento del marito ,causa,"('red', 2, 1)",red,False,0.0,False
827,No perchè sto facendo questo percorso ,causa,"('red', 2, 1)",red,False,0.0,False
828,immaginando faccia parte di una minoranza nel suo ambiente,conferma,"('red', 2, 1)",red,False,0.0,False
829,"La ricerca umanistica e scientifica è di stimolo e aggiornamento, spinta vitale e prolifica.",conferma,"('red', 2, 1)",red,False,0.0,False
830,"infatti, spesso invita a cena amici o trascorre con gli stessi parte del suo tempo libero.",conferma,"('red', 2, 1)",red,False,0.0,False
831,"anche perché i dottori stessi ci avevano detto che lui una volta operato lui era un bambino normale, un bambino sano, doveva essere trattato come un bambino sano, non come un bambino malato, e quindi da dargli delle, lasciargli delle opportunità insomma…",conferma,"('red', 2, 1)",red,True,1.0,False
832,anche perché in generale il periodo estivo è più rilassato per lei,conferma,"('red', 2, 1)",red,True,1.0,False
833,come è successo a me che a otto anni che ero stato bullizzato.,conferma,"('red', 2, 1)",red,False,0.0,False
834,Così come io non ne sapevo nulla prima di vivere l'esperienza su di me.,conferma,"('red', 2, 1)",red,True,1.0,False
835,"credo sia dovuto alla mia indole troppo sensibile, alla detenzione carceraria.",conferma,"('red', 2, 1)",red,False,0.0,False
836,"che oggi guardano non solo gli affreschi del '300 ma anche e soprattutto la qualità ambientale, sociale e la qualità dei servizi.",conferma,"('red', 2, 1)",red,False,0.0,False
837,"E non saranno più “persone con disturbi mentali” che si radicalizzano rapidamente sul web e che colpiscono con armi da taglio o autovetture, come avvenuto nella maggior parte dei casi negli ultimi mesi, ma ex combattenti con addestramento militare, ",confronto,"('red', 6, 4)",red,True,1.0,False
838,"Devo stare più attenta di altri all'alimentazione, ad evitare strapazzi, fumo, alcool. Mediamente devo sottopormi ad una serie maggiore di controlli che chi non ha una patologia cardiaca congenita non deve fare.",confronto,"('red', 6, 4)",red,True,1.0,False
839,"Come tutte le persone che contraggono una ""malattia"" anche chi ha l'AIDS resta sorpreso e ansioso per la situazione ",confronto,"('red', 6, 4)",red,False,0.0,False
840,"l'operatore la vedrà come una persona ""nuova"" rispetto a prima.",confronto,"('red', 6, 4)",red,True,1.0,False
841,"Ella che nell’appartamento si muove abbastanza bene, all'esterno ha seri problemi di deambulazione ",confronto,"('red', 6, 4)",red,True,1.0,False
842,Ha perso la voglia di fare le cose che faceva una volta,confronto,"('red', 6, 4)",red,True,1.0,False
843,sono infatti i più grandini che hanno sempre pensato a tutto compresa la mamma stessa.,conferma,"('red', 2, 1)",red,False,0.0,False
844,perché tipo una volta ho preso la tosse e mi faceva male il cuore…questo da quando mi sono operata questo mi è successo sempre.,conferma,"('red', 2, 1)",red,False,0.0,False
845,"vabbè, ma era un neonato quindi era anche plausibile questo, come gli dai il latte gli ascolti il cuore.",conferma,"('red', 2, 1)",red,False,0.0,False
846,processo che passa attraverso il lavoro o percorsi individualizzati che la REMS non è in grado di fornire in parte per questioni burocratiche e in parte per il numero esiguo di personale dedicato. Un servizio di cui si beneficia per un tempo limitato per poi dedicarsi ad altro.,conferma,"('red', 2, 1)",red,True,1.0,False
847,"che è migliorata che non sarebbe più la stessa persona, ",confronto,"('red', 6, 4)",red,False,0.0,False
848,"alcuni cercano di seguire la terapia e si sforzano di capire, altri non hanno fiducia e si lasciano andare",confronto,"('red', 6, 4)",red,False,0.0,False
849,"All'interno del reparto la qualità del personale, sia medico che non, è buona ed anche la gestione dei pazienti e le procedure sono buone ma ci sono difficoltà nella comunicazione con i medici dall'esterno in caso di problemi durante la vita quotidiana.",confronto,"('red', 6, 4)",red,False,0.0,False
850,Non posso scriverlo,commento,"('red', 3, 1)",red,False,0.0,False
851,non può fare molto,commento,"('red', 3, 1)",red,True,1.0,False
852,Non è un problema facilmente risolvibile:per molti zero macchine vuol dire zero negozi e quindi strade abbandonate ai clandestini ed agli spacciatori;,commento,"('red', 3, 1)",red,False,0.0,False
853,non ho idea di come possa essere la persona al termine della presa in carico. ,commento,"('red', 3, 1)",red,True,1.0,False
854,"non essendoci “pozioni magiche”che possono cancellare il dolore, sicuramente la presenza di persone sensibili, emotivamente competenti e ascoltatori preparati, potrebbero alleviare la profonda ferita e  sostenere  senza giudizio, “la congiura del silenzio” che spesso contraddistingue il contesto familiare dei dolenti.  sicuramente il valore di una comunicazione consapevole e autentica basata sulla presenza e vicinanza sia fisica che emotiva, premessa per un sostegno significativo auspicato dagli operatori soproxi, diventa la consapevolezza  per imparare a convivere  con l’assillante ricerca del “perché” un proprio caro si sarebbe tolto la vita, senza  per questo aspettarsi una risposta chiara e definitiva:  esperienza che non le toglie il dolore ma lo trasforma  in accettazione .affrontare il proprio dolore significa, accogliere la propria ferita, troppo spesso congelata dal silenzio e dall’indifferenza sociale, dare voce al pianto solitario e poterlo condividere con rispetto; interazioni queste intra e interpersonali che favoriscono legami di solidarietà con altri significativi.. ",commento,"('red', 3, 1)",red,False,0.0,False
855,Oltre a questo non so cosa intende con questa domanda.,commento,"('red', 3, 1)",red,True,1.0,False
856,"penso che i comportamenti dei docenti universitari, grossomodo è gaussiano, formando due estremi,",commento,"('red', 3, 1)",red,False,0.0,False
857,"penso che nella preparazione in psicologia ci siano due componenti fondamentali, una teorica che si impara studiando ed una pratica che si impara facendo le cose",commento,"('red', 3, 1)",red,False,0.0,False
858,"non so. Spero sempre di uscirne come l'ho fatto. Questa è più dura.
 Gli anni sono andati avanti, mi riprendevo,cadevo dopo quel tappeto.
 Poi sono stata al Parco dei Tigli.",commento,"('red', 3, 1)",red,False,0.0,False
859,ogniuno a la sua vita ed ha l'età per intendere e volere.,commento,"('red', 3, 1)",red,False,0.0,False
860,"non vedo l’ora che adesso le strutture, mi parlano le dottoresse tra qua e i prossimi 2/3 anni dovrebbe cambiare tutto in meglio.",commento,"('red', 3, 1)",red,False,0.0,False
861,"lui ha violato l’infanzia della mia sorellastra ad appena 8 anni di vita, non
so se dopo ha continuato con il suo vizio, ma so che all’età di 12 anni lui
scherzava con me sul ciglio del letto, adagiandomi giù disse “sei stupenda”.
",commento,"('red', 3, 1)",red,False,0.0,False
862,"ma altrettanto colpevoli sono le persone che non hanno fatto nulla per impedire la violenza, ma che sono rimaste a guardare la scena come se fosse un programma televisivo, in attesa dell'eroe di turno a fermare i criminali.",commento,"('red', 3, 1)",red,False,0.0,False
863,"ma ripeto, ne ho viste, ne vedo talmente tante che, con le varie situazioni, cardiopatie, neurologia, insomma, quindi, mi dico…mmh, sì, ci sono delle, sicuramente una persona:",commento,"('red', 3, 1)",red,False,0.0,False
864,Mah ! tra i cittadini di Padova vedo moltissima indifferenza e pochissimo senso di comunità; questo è presente solo nelle Associazioni che fanno quel che possono; la stragrande maggioranza se ne frega,commento,"('red', 3, 1)",red,False,0.0,False
865,non capivano il mio forte disagio all'inizio mi sono stati vicino,commento,"('red', 3, 1)",red,True,1.0,False
866,mi auguro che le persone vicine che abitano questo territorio siano capaci di consigliare e accompagnare la persona presso una struttura come soproxi.,commento,"('red', 3, 1)",red,False,0.0,False
867,"Molto semplicemente ritengo che siano tutti cardiopatici e non attaccati ad un esile filo che è la macchina uomo, complessa, incredibile ma purtroppo estremamente fragile.",commento,"('red', 3, 1)",red,False,0.0,False
868,penso che un operatore del servizio si sentirebbe ancora più responsabile e abbattuto.,commento,"('red', 3, 1)",red,False,0.0,False
869,Penso di aver già risposto.,commento,"('red', 3, 1)",red,True,1.0,False
870,si auspica un incremento di spazi dedicati agli studenti all'interno dei Quartieri,commento,"('red', 3, 1)",red,False,0.0,False
871,"Se riesco a camminare, cammino. Sennò resto a casa.",commento,"('red', 3, 1)",red,True,1.0,False
872,se mantengo il peso vuol dire che non ci sono problemi fisiologici,commento,"('red', 3, 1)",red,False,0.0,False
873,Tutti,commento,"('red', 3, 1)",red,True,1.0,False
874,sono positivi,commento,"('red', 3, 1)",red,False,0.0,False
875,Sono una persona pacifica e sono stato anche renitente alla leva.,commento,"('red', 3, 1)",red,False,0.0,False
876,spingendoti a capire che quello che ti serve non è la competenza in se ma il percorso che ti porterà a quella competenza,commento,"('red', 3, 1)",red,False,0.0,False
877,"Penso che…boh io l’unica esperienza che ho è quella di Ashi, penso che potrei rifarmi alla sua esperienza, cioè che, (…) Ashi è arrivato dall’india che aveva un anno, per cui abbiamo cominciato con un certo ritardo a fare queste cure no?, quindi, sì, questi interventi, quindi lui ha finito a quattro anni,",commento,"('red', 3, 1)",red,False,0.0,False
878,"però a me questo sinceramente, a noi è servito per fare un’ennesima cernita delle persone che frequentavamo, al punto che cioè, ciao, addio, i rami secchi si tagliano.",commento,"('red', 3, 1)",red,True,1.0,False
879,"però essendo fiduciosi prima nel nostro Signore, e poi essendo fiduciosi nella medicina, nei dottori, ecco, ringraziando il Signore oggi mia figlia sta bene, sta bene, e abbiamo così diciamo superato, superato quel periodo che era veramente un periodo piuttosto difficile da superare, però, però ringraziando il Signore abbiamo superato, oggi mia figlia sta bene,",commento,"('red', 3, 1)",red,False,0.0,False
880,"però la, la mia felicità, o il momento di, di scoraggio, eeh, io lo posso solo condividere con chi si trova nella mia situazione, è un po’ difficile condividere le cose con chi, anche se io ne parlo con te, però tu non hai vissuto, non abbiamo vissuto insieme la stessa esperienza, allora se la condividi ti dai anche forza per andare avanti, o no?, oppure ti ricordo, infatti noi ogni tanto ci vediamo con, come si chiama…con Nadia e Franco no?, ogni tanto, e quindi ci ricordiamo, ogni tanto menzioniamo certe cose che abbiamo fatto, così e colà, ma perché le abbiamo fatte insieme, se lo racconto a un esterno è una notizia che lui prende, il giorno dopo non si ricorda, hai capito?, quindi…",commento,"('red', 3, 1)",red,True,1.0,False
881,per ovvie ragioni,commento,"('red', 3, 1)",red,False,0.0,False
882,"questo va a dire che cuoca sono, quindi…",commento,"('red', 3, 1)",red,False,0.0,False
883,"poi c’era una mamma che abitava a Padova, che lei mi vedeva ogni anno, però, anche io vedevo lei, però questo ragazzino ha avuto di più interventi, di più, più parlavo con la gente italiana che la gente che conosco, ti spiego là…e quando non vedevo, magari se non li vedevo subito ero preoccupata, perché sapevo che questo ragazzino che aveva più interventi da fare, più con i genitori, Hallem, lui ci ha aiutato tanto anche quando, dall’inizio, tutto quanto, loro di più mi hanno sostenuto, altre persone, abbiamo parlato, anche lui: lui era tanto vicino a noi, anche quando mi vede, parliamo magari, ti viene in mente tutto, hai capito?, anche adesso quando è successo per il nipotino, mia nipote ha avuto il bambino che è stato operato, aveva un buchetto, io ho rivissuto tutto quello che vivevo per lei, però grazie al Signore tutto a posto, tutto bene dai.",commento,"('red', 3, 1)",red,False,0.0,False
884,"poi, a parte che Giacomo è talmente vivace, allegro che sembra non abbia veramente avuto niente se non vedi il taglio sullo stomaco e basta;",commento,"('red', 3, 1)",red,True,1.0,False
885,"ma la cosa positiva è che la coppia riesce ad adottare un bambino. 
",giudizio,"('red', 3, 1)",red,False,0.0,False
886,"ma purtroppo la lista d'attesa è lunga, ",giudizio,"('red', 3, 1)",red,True,1.0,False
887,"Lo potrebbero descrivere come un ragazzo che non ha una vita per niente facile, con il mondo che gli crolla addosso ogni giorno.",giudizio,"('red', 3, 1)",red,True,1.0,False
888,"Mah, per il momento siamo stati abbastanza soddisfatti,",giudizio,"('red', 3, 1)",red,True,1.0,False
889,"malato, aiutato però un po' incompreso.",giudizio,"('red', 3, 1)",red,False,0.0,False
890,meglio se non mi capita,giudizio,"('red', 3, 1)",red,True,1.0,False
891,lo descriverei come un normale iter assistenziale.,giudizio,"('red', 3, 1)",red,True,1.0,False
892,La popolazione padovana è un po' chiusa,giudizio,"('red', 3, 1)",red,False,0.0,False
893,"Le REMS, a differenza di qualsiasi posto dove scontare una pena è molto differente,",giudizio,"('red', 3, 1)",red,True,1.0,False
894,"Le parole che mi vengono in mente sono: “oddio povero genitore, guarda cosa gli è toccato, guarda che vita deve fare ad avere un figlio malato così, e poi chissà se mai riuscirà a guarire”. Cioè, le uniche parole che mi vengono in mente.",giudizio,"('red', 3, 1)",red,False,0.0,False
895,"le difficoltà, ma anche la bellezza dell'incontro ",giudizio,"('red', 3, 1)",red,False,0.0,False
896,"Oddio, questa…cioè, mi immedesimo quindi a quello che abbiamo vissuto però, perché, mmh…eh, però ripeto quello che ho detto prima, perché, nel senso che…cioè mmh…una persona, poi dovrei immedesimarmi per l’esperienza che ho finora, di un neonato, di un bambino…eeh, cioè, se mi dovessi, in base alla mia esperienza mi immedesimo in quello che ho visto in mia figlia, lei l’ho vista anche, grazie a Dio, abbastanza serena e tranquilla, quindi…",giudizio,"('red', 3, 1)",red,False,0.0,False
897,non molto utile.,giudizio,"('red', 3, 1)",red,True,1.0,False
898,"Non so se ci saranno dei forti cambiamenti,",giudizio,"('red', 3, 1)",red,True,1.0,False
899,Paziente consapevole del proprio stato di malessere psico-fisico,giudizio,"('red', 3, 1)",red,True,1.0,False
900,Penserei che tutte le persone coinvolte sono state molto brave e professionali.,giudizio,"('red', 3, 1)",red,False,0.0,False
901,Ottimo,giudizio,"('red', 3, 1)",red,False,0.0,False
902,Molto bene,giudizio,"('red', 3, 1)",red,False,0.0,False
903,Mio papà è forte e ha sempre lottato per il suo bene oltre che averci insegnato tanto.,giudizio,"('red', 3, 1)",red,True,1.0,False
904,"Mi sento sempre triste, non ho voglia di fare nulla. Gli altri mi spronano ma non capiscono come sto: non ricordo l’ultima volta in cui mi sono sentito pienamente felice e realizzato. Mi sembra di non valere nulla. In famiglia dicono che mi lamento sempre e non concludo niente, ma sono sempre stanco. Non so come fare. Mi sembra di essermi sempre sentito così: se mi guardo indietro mi pare di non aver combinato nulla di buono nella mia vita.",giudizio,"('red', 3, 1)",red,False,0.0,False
905,migliorato,giudizio,"('red', 3, 1)",red,False,0.0,False
906,"Nel momento in cui una persona si rivolge a un CSM per senso comune la descriverei come una persona che ""non sta bene"" o che ""non fa bene agli altri"" ovvero diventa pericolosa per se stessa e per chi le sta intorno. Mi immagino sia casi gravi ma anche disturbi più lievi",giudizio,"('red', 3, 1)",red,False,0.0,False
907,"Necessità di raccontare la concretezza e l'attualità delll'iter, formare conoscenze e competenze e fornire stimoli a chi volesse approfondire il tema. Importanza della preparazione delle coppie, conoscenza dei limiti e valutazione delle reali disponiilità ",giudizio,"('red', 3, 1)",red,False,0.0,False
908,Nel corso dei colloqui emerge un forte interesse per i figli e il desiderio di migliorare la sua condizione abitativa e sociale anche e soprattutto per loro.,giudizio,"('red', 3, 1)",red,False,0.0,False
909,il problema è che allo stato attuale per i vari impegni il ragazzo appare stanco.,giudizio,"('red', 3, 1)",red,True,1.0,False
910,Il quartiere accoglie positivamente la componente universitaria,giudizio,"('red', 3, 1)",red,False,0.0,False
911,"Il mio invio presso la REMS è avvenuto attraverso un percorso particolarmente difficile molto complicato da spiegare,",giudizio,"('red', 3, 1)",red,True,1.0,False
912,"Il classico ragazzo intenzionato a prevalere sugli altri e a volersi mettere al centro dell'attenzione, pur offendendo pesantemente la ragazza.",giudizio,"('red', 3, 1)",red,True,1.0,False
913,Il sig. Rossi è cresciuto in una famiglia serena e benestante; ,giudizio,"('red', 3, 1)",red,False,0.0,False
914,"gonfio, assente, spaesato, ferito, risocializzato impaurito",giudizio,"('red', 3, 1)",red,False,0.0,False
915,"Giusti. Credo che la cittadinanza non si aspetti i miracoli,ma l'essenziale ed il dovuto per vivere serenamente.",giudizio,"('red', 3, 1)",red,False,0.0,False
916,"Giulia esiste, in attesa di vivere.",giudizio,"('red', 3, 1)",red,False,0.0,False
917,"G. prende sul serio il suo lavoro e la materia che studia,",giudizio,"('red', 3, 1)",red,False,0.0,False
918,già fortemente compromesso.  ,giudizio,"('red', 3, 1)",red,False,0.0,False
919,"ha queste base non solo a livello morale ma anche a livello accademico con un pizzico di presunzione di conoscere la psicologia che conta,",giudizio,"('red', 3, 1)",red,True,1.0,False
920,"I loro figli trascorrono molto tempo a giocare con M., F. e S. e",giudizio,"('red', 3, 1)",red,False,0.0,False
921,i miei amici normale in uno stato di agitazione e confusione,giudizio,"('red', 3, 1)",red,False,0.0,False
922,"I servizi di Padova sono perfetti,",giudizio,"('red', 3, 1)",red,False,0.0,False
923,"i tempi di attesa molto lunghi, ",giudizio,"('red', 3, 1)",red,False,0.0,False
924,L'utente nel corso dell'infanzia è stato precocemente istituzionalizzato insieme al fratello maggiore M.; ,giudizio,"('red', 3, 1)",red,False,0.0,False
925,"io se fossi una persona con una cardiopatia congenita penso che la vivrei positivamente,",giudizio,"('red', 3, 1)",red,False,0.0,False
926,"Iter regolare, buona assistenza ed interventi risolutivi complessi con ottimi risultati.",giudizio,"('red', 3, 1)",red,True,1.0,False
927,"L’ansia che aveva iniziato ad accompagnarmi e a fare da sfondo costante delle mie giornate, prese il sopravvento. Crisi sempre più frequenti, fino ad arrivare al panico incontrollabile.",giudizio,"('red', 3, 1)",red,False,0.0,False
928,"l'abitazione, eccessivamente piccola ",giudizio,"('red', 3, 1)",red,False,0.0,False
929,In tutto ciò iniziai ad odiare mia madre dal primo giorno. Non credo di aver mai voluto così male a qualcuno. ,giudizio,"('red', 3, 1)",red,True,1.0,False
930,In generale è sempre positiva.,giudizio,"('red', 3, 1)",red,True,1.0,False
931,"in una maniera che potremmo definire pessima,",giudizio,"('red', 3, 1)",red,False,0.0,False
932,"Io mi descriverei un genitore di una figlia ""speciale"".",giudizio,"('red', 3, 1)",red,True,1.0,False
933,"insicuro , instabile",giudizio,"('red', 3, 1)",red,False,0.0,False
934,insicura,giudizio,"('red', 3, 1)",red,False,0.0,False
935,Ti seguono prima del mandato e subito dopo il mandato poi un po si perdono e sono meno presenti e disponibili a sostenere la coppia in quella che è la fase di attesa più snervante dove si attende... ,giudizio,"('red', 3, 1)",red,True,1.0,False
936,Tante persone ci giudicano (noi genitori) bravi…,giudizio,"('red', 3, 1)",red,False,0.0,False
937,Uguali ma a ritmo ridotto,giudizio,"('red', 3, 1)",red,False,0.0,False
938,"triste, negativa, ipotomica",giudizio,"('red', 3, 1)",red,False,0.0,False
939,"Soggetto equilibrato che sa controllare i propri istinti, stabilire rapporti in perfetta armonia con l’ambiente che lo circonda e sapersi relazionare con gli altri esseri umani.",giudizio,"('red', 3, 1)",red,False,0.0,False
940,"Solitamente ci sentiamo dire che siamo forti,",giudizio,"('red', 3, 1)",red,True,1.0,False
941,"sono di nuovo io…ancora più triste, sconvolta e delusa di
quanto lo ero già ieri…..sta venendo a galla tutto lo schifo che in questi
anni era sepolto",giudizio,"('red', 3, 1)",red,False,0.0,False
942,"sono inutile non so fare niente sono un peso per gli altri,",giudizio,"('red', 3, 1)",red,False,0.0,False
943,Sono una persona in genere estroversa,giudizio,"('red', 3, 1)",red,False,0.0,False
944,"Sono una brava cittadina, non spaccio, non bevo",giudizio,"('red', 3, 1)",red,False,0.0,False
945,una signora anziana quasi inferma che dimostra forte intolleranza verso il nucleo.,giudizio,"('red', 3, 1)",red,True,1.0,False
946,"Una vita perfetta. Ho raggiunto tutti i miei obiettivi, realizzato i miei
sogni…. laureata, specializzata, sposata, madre di due figli….ma
all’improvviso compare un dolore… li dov’era riposta una strana storia, li
dov’era chiusa una relazione fuori dagli schemi ma pur sempre una relazione, in un cassetto in fondo all’anima.",giudizio,"('red', 3, 1)",red,False,0.0,False
947,Una persona un po' più sfortunata delle altre.,giudizio,"('red', 3, 1)",red,False,0.0,False
948,una persona triste,giudizio,"('red', 3, 1)",red,True,1.0,False
949,una persona triste,giudizio,"('red', 3, 1)",red,False,0.0,False
950,"a causa di problematiche insorte e non risolte, non hanno dato esiti positivi e duraturi nel tempo. ",giustificazione,"('red', 4, 1)",red,True,1.0,False
951,vive normalmente la propria vita,giudizio,"('red', 3, 1)",red,False,0.0,False
952,"vivendo anche in condizioni precarie, ",giudizio,"('red', 3, 1)",red,False,0.0,False
953,"vuota, senza energia, inutile, in colpa, un peso per gli altri",giudizio,"('red', 3, 1)",red,False,0.0,False
954,Una dittatura folle,giudizio,"('red', 3, 1)",red,False,0.0,False
955,una persona depressa ha poco interesse per ciò che la circonda e per la propria vita. E' più debole fisicamente,giudizio,"('red', 3, 1)",red,False,0.0,False
956,"una persona disorientata, preoccupata arrabbiata, incompresa dalla società o peggio dalla propria famiglia",giudizio,"('red', 3, 1)",red,False,0.0,False
957,"una persona impegnata a livello personale e sociale,",giudizio,"('red', 3, 1)",red,False,0.0,False
958,una persona che sa gestire (è in grado di gestire) la propria vita in modo autonomo e le cui scelte non risultano dannose a se e agli altri,giudizio,"('red', 3, 1)",red,False,0.0,False
959,"una persona che si da da fare, una persona attiva, appassionata a quello che fa,",giudizio,"('red', 3, 1)",red,False,0.0,False
960,"sì, mi hanno reso una persona più, magari più paurosa, sempre propositiva ma ho dei momenti anche io in cui dico “però mamma mia, questa cosa mi spaventa moltissimo”, questo sì, mi ha reso una persona più paurosa.",giudizio,"('red', 3, 1)",red,False,0.0,False
961,"Poi la complessità del mettersi in gioco, essere  ""analizzati"" e valutati da persone terze non è semplice per un aspirante genitore, ",giudizio,"('red', 3, 1)",red,False,0.0,False
962,"poi che si facciano pagare o meno è un'altra questione, ma almeno fanno qualcosa. ",giudizio,"('red', 3, 1)",red,False,0.0,False
963,"piagnucolosa, che non è nessuno, triste, con cattivi pensieri",giudizio,"('red', 3, 1)",red,False,0.0,False
964,poco ospitale,giudizio,"('red', 3, 1)",red,True,1.0,False
965,pronta a riaffrontare la vita quotidiana con maggior coscienza di stesso,giudizio,"('red', 3, 1)",red,False,0.0,False
966,Qualsiasi persona che non abbia le 5 seguenti (negative) caratteristiche può essere reclutata:,giudizio,"('red', 3, 1)",red,False,0.0,False
967,"Professionale
Disponibile
Gentile",giudizio,"('red', 3, 1)",red,False,0.0,False
968,perchè ero carina.,giudizio,"('red', 3, 1)",red,False,0.0,False
