,text,label2,p,label,is_valid,set_tag,is_test
557,Certamente ha delle IMPLICAZIONE perché si vive in continuo stato di ansia per il futuro del proprio figlio.,sancire,"('red', 1, 0)",red,False,0.0,False
558,"Cercherei di fare,",sancire,"('red', 1, 0)",red,True,1.0,False
559,che sta bene con se stesso quindi con gli altri e che nn ha problemi di salute.,sancire,"('red', 1, 0)",red,True,1.0,False
560,che non ha saputo gestire ,sancire,"('red', 1, 0)",red,True,1.0,False
561,che lo vedrà impegnato una volta a settimana.  ,sancire,"('red', 1, 0)",red,False,0.0,False
562,"Sul mio concetto, sul mio modo di vedere le cose.",sancire,"('red', 1, 0)",red,False,0.0,False
563,"Tale spazio abitativo è condiviso anche dal soggetto in esame, che ha vissuto con profonda sofferenza la separazione dei genitori, ",sancire,"('red', 1, 0)",red,True,1.0,False
564,"tanti altri che non conosco, uno ne conosco, una cooperativa ""nuovi spazi""",sancire,"('red', 1, 0)",red,False,0.0,False
565, I medici non hanno dubbi: depressione.,sancire,"('red', 1, 0)",red,False,0.0,False
566, era il gesto che aveva dichiarato definitivamente lo stato di allarme: non era ‘’un’impressione’’!,sancire,"('red', 1, 0)",red,False,0.0,False
567," è il ns segreto,",sancire,"('red', 1, 0)",red,False,0.0,False
568,subisce la personalità autoritaria del marito senza troppa ribellione.,sancire,"('red', 1, 0)",red,False,0.0,False
569,Tentacolare,sancire,"('red', 1, 0)",red,True,1.0,False
570,"Umore basso per la maggior parte della giornata, perdita d’interesse per le cose quotidiane, svogliatezza,sensazione di stanchezza. Sintomi di scarso appetito, o aumento di quest'ultimo, sintomi sulla dimensione del sonno quale insonnia oppure ipersonnia. Presenza o meno di disturbi d’ansia.",sancire,"('red', 1, 0)",red,False,0.0,False
571,"un contesto  come quello sopranominato che permette di elaborare il proprio dolore rispettando la complessità dei sentimenti che dall’ autoaccuasa, vergogna, colpa, rabbia  spesso arrivano  a contemplare l’ipotesi del suicidio, contribuisce a tenere aperto il cuore, ad andare oltre l’attaccamento allo scomparso,",sancire,"('red', 1, 0)",red,False,0.0,False
572,Tutto quello che posso dire è che stiamo vivendo con benedizione qui e voi dovreste venire nello Stato Islamico.,sancire,"('red', 1, 0)",red,False,0.0,False
573,tossicodipendente (con una dipendenza da sostanze stupefacenti),sancire,"('red', 1, 0)",red,True,1.0,False
574,"tutto cambia in fretta, i seminari ad esempio non esistono quasi più,",sancire,"('red', 1, 0)",red,True,1.0,False
575," In quel momento sentivo che  mi mancava l’ aria avevo troppo  paura , non volevo ,e mentre i minuti passavano io speravo che lui aveva dimenticato di me.",sancire,"('red', 1, 0)",red,True,1.0,False
576,A cio’ si è aggiunto l’aver avuto una famiglia abusante.. (…) io sono sempre stata sola..DA SOLA HO DOVUTO FAR TUTTO…,sancire,"('red', 1, 0)",red,False,0.0,False
577,"6
 Le scelte sulla mobilità sono sentite proprie dai cittadini",sancire,"('red', 1, 0)",red,True,1.0,False
578,"2
 Non vengono mai prese decisioni",sancire,"('red', 1, 0)",red,False,0.0,False
579,"Al-Jazira impone un nuovo stile di informazione che rompe radicalmente con i vecchi modelli. La situazione del finanziatore, il Qatar, permette ogni audacia.",sancire,"('red', 1, 0)",red,True,1.0,False
580,"1) SAPERE ASCOLTARE TUTTO CIò CHE HA DA ESPRIMERE;
 2) FARLO ESPRIMERE IN BASE ALLE MODALITà PRIVILEGIATE: SCRITTURA, CANTO, PITTURA, DANZA, ATTIVITà MANUALI;
 
 4) AVERE ALL'INTERNO DEL CENTRO DELLE FIGURE CHE SAPPIANO DIALOGARE CON MODALITà DIVERSE IN BASE ALLA PERSONA;
 
 6) VALORIZZARLO 
 7) ESSERE IN UN AMBIENTE CONFORTEVOLE, PULITO, LUMINOSO, COLORATO,
 .",sancire,"('red', 1, 0)",red,True,1.0,False
581,"Agire sulle conseguenze, aspettare che riesci a prendere l’appetito,",sancire,"('red', 1, 0)",red,False,0.0,False
582,Adesso non penso proprio che posso permettermi di fare cose che facevo…per il momento.,sancire,"('red', 1, 0)",red,False,0.0,False
583,accetta di aver bisogno di aiuto,sancire,"('red', 1, 0)",red,False,0.0,False
584,abitudinariamente,sancire,"('red', 1, 0)",red,False,0.0,False
585,Abbia difficoltà nel relazionarsi in modo sano con le persone,sancire,"('red', 1, 0)",red,False,0.0,False
586,"1) L'UNICA VOCE ""CONTRO"" E' QUELLA DI QUALCHE AMBIENTALISTA E COMITATO DI QUARTIERE CHE ",sancire,"('red', 1, 0)",red,False,0.0,False
587," un sopravvissuto è abbandonato, solo nei propri pensieri e sentimenti, incapace (trattenuto) a condividere la propria esperienza.",sancire,"('red', 1, 0)",red,False,0.0,False
588," Perché chi subisce una molestia o una violenza non vive , ma ‘SOPRAVVIVE’ .”",sancire,"('red', 1, 0)",red,False,0.0,False
589," Un uomo che però, da bambina, per me era solo un papà cattivo",sancire,"('red', 1, 0)",red,False,0.0,False
590,"…la verità è che mi vergogno perché dovrei dire che a casa mia le brave ragazze subiscono in silenzio, che si tratti delle attenzioni sessuali di un genitore o di maltrattamenti in famiglia… ",sancire,"('red', 1, 0)",red,False,0.0,False
591,"Con il mondo civile si è provato a divulgare cultura: abbiamo provato a inserirci nel teritorio, essere disponibili e aperti. ",sancire,"('red', 1, 0)",red,False,0.0,False
592,"qualità dei servizi offerti e del personale, volontà di reinserire la persona nel proprio contesto sociale e non di assistenzialismo",sancire,"('red', 1, 0)",red,False,0.0,False
593,quando sarà,sancire,"('red', 1, 0)",red,False,0.0,False
594,Quel giorno è successo qualcosa di spaventosamente inquietante  E quel giorno ha cambiato tutta la mia vita. In modo irreversibile.  Non l’ho mai presa troppo sul serio. ,sancire,"('red', 1, 0)",red,False,0.0,False
595,"Quella attualmente protagonista è una generazione formata da persone determinate e pronte al martirio, difficilmente individuabili poiché agiscono autonomamente senza dover per forza far parte di un’organizzazione terroristica e perfettamente in grado di fondersi con l’Occidente dove vivono o sono nati. Questi individui inoltre sono in grado di sfruttare a pieno tutti i mezzi moderni di informazione e comunicazione (web e social).",sancire,"('red', 1, 0)",red,True,1.0,False
596,"pubblici, il consultorio famigliare
 alcune cooperative o onlus che si occupano di tempo libero come punti di incontro e condivisione",sancire,"('red', 1, 0)",red,False,0.0,False
597,preferisco prima conoscermi.,sancire,"('red', 1, 0)",red,False,0.0,False
598,prendo i farmaci .,sancire,"('red', 1, 0)",red,False,0.0,False
599,"Presenza di personale del CSM competenze in maniera adeguata e con organizzazione efficiente per rispondere al bisogno.
 Strutture semiresidenziali e residenziali.
 Interventi integrati di altre agenzie del territorio (Servizi Sociali, Cooperative di LAvoro, Enti di volontariato).",sancire,"('red', 1, 0)",red,False,0.0,False
600,principalmente nella sanità anche se poi è il privato quello che tutti vogliono,sancire,"('red', 1, 0)",red,False,0.0,False
601,Probabilmente ci sarà sicuramente un miglioramento dellle condizioni psicofisiche e una diversa consapevolezza del proprio ruolo nella tragedia.,sancire,"('red', 1, 0)",red,False,0.0,False
602,resta la tristezza il senso di vuoto e il dolore.,sancire,"('red', 1, 0)",red,False,0.0,False
603,"risorse utili possono essere qualsiasi figura all'interno del CSM, dallo psicologo all'infermiere.
 Daiventano utili nel momento in cui considerano l'utente non come un malato ma come una persona in grado di ""uscirne"" anche con le proprie forze se trova la POSSIBILITA",sancire,"('red', 1, 0)",red,False,0.0,False
604,praticamente nulla,sancire,"('red', 1, 0)",red,False,0.0,False
605,"Quest’ultima si carico quotidianamente della madre, ",sancire,"('red', 1, 0)",red,False,0.0,False
606,"quindi io penso, cioè mi immagino che se fossi al suo posto per me sarebbe la stessa cosa, cioè sentirei questa, cioè avrei un’implicazione, l’implicazione sarebbe sapere che la mia vita è scandita da queste cose, (…) però di avere questo condizionamento diciamo;",sancire,"('red', 1, 0)",red,True,1.0,False
607,potrebbe solo che migliorare il quartiere,sancire,"('red', 1, 0)",red,False,0.0,False
608,"Pensano che siamo professionali, ed pazienti nei loro confronti, e pronti a sentire e aiutare nel limite il favorire della loro permanenza in struttura. ",sancire,"('red', 1, 0)",red,False,0.0,False
609,Penso che un utente a lungo andare riesca a comprendere l'efficacia di una struttura REMS,sancire,"('red', 1, 0)",red,False,0.0,False
610,"per cui come reazione che loro…che può avere su di me, non c’è nessuna implicazione signore, e questo è quanto.",sancire,"('red', 1, 0)",red,False,0.0,False
611,P. sta prendendo contatti anche con strutture di volontariato presenti a G..,sancire,"('red', 1, 0)",red,False,0.0,False
612,Padova gode della presenza di molti universitari,sancire,"('red', 1, 0)",red,False,0.0,False
613,"Per lui il padre ha sempre rappresentato un importante e costante punto di riferimento, un modello, e particolarmente in età adulta, lavorando nello stesso ambiente, il loro rapporto si era ulteriormente intensificato condividendo interessi, conoscenze ed esperienze. ",sancire,"('red', 1, 0)",red,True,1.0,False
614,più spazio alle iniziative per studenti,sancire,"('red', 1, 0)",red,True,1.0,False
615,"Poi, il fatto di condividere con altri e con altre persone,",sancire,"('red', 1, 0)",red,False,0.0,False
616,"Per quanto riguarda la situazione personale di D. egli si sta impegnando con costanza nell'approfondimento personale con lo psicologo D. I. della ASL RM/.., che per l'odierna Udienza ha redatto una relazione che si allega alla presente. ",sancire,"('red', 1, 0)",red,True,1.0,False
617,"Perché chi subisce una molestia o una violenza non vive , ma ‘SOPRAVVIVE’ .”",sancire,"('red', 1, 0)",red,False,0.0,False
618,"Perché mi fanno tante cose,",sancire,"('red', 1, 0)",red,False,0.0,False
619,Perché mi piace fare quello che faccio,sancire,"('red', 1, 0)",red,True,1.0,False
620,"persa, morta, senza senso.",sancire,"('red', 1, 0)",red,True,1.0,False
621,"perché, ripeto, per me non c'è stato nessun cambiamento è rimasto uguale preciso",sancire,"('red', 1, 0)",red,False,0.0,False
622,"Riuscire a lavorare come facevo prima, ",sancire,"('red', 1, 0)",red,False,0.0,False
623,sono proprio una stupida. Ma non importa… lui mi ama ed io lo amo.  ,sancire,"('red', 1, 0)",red,False,0.0,False
624,"sono sempre meno gli esperti di visioni generali,",sancire,"('red', 1, 0)",red,True,1.0,False
625,"Sono sempre stata una ragazza solare e allegra, ma dietro il mio sorriso c’è un dolore enorme che porto da anni. ",sancire,"('red', 1, 0)",red,True,1.0,False
626,"sono sicuramente privilegiate le competenze relative alla psicologia generale, fisiologia, lo sviluppo, la dinamica e la clinica",sancire,"('red', 1, 0)",red,True,1.0,False
627,Soprattutto cosciente delle proprie POSSIBILITA e limiti,sancire,"('red', 1, 0)",red,False,0.0,False
628,Spero che bene,sancire,"('red', 1, 0)",red,False,0.0,False
629,sono proprio infelice,sancire,"('red', 1, 0)",red,False,0.0,False
630,"Sicuramente risposo, ricontatttare tutti quelli che mi hanno cercato e a cui non ho dato risposte",sancire,"('red', 1, 0)",red,False,0.0,False
631,sicuramente si trova in una situazione negativa e triste.,sancire,"('red', 1, 0)",red,False,0.0,False
632,smettere di assumere sostanze psichedeliche e anche l'erba per prima perché mi sono affezionato agli altri,sancire,"('red', 1, 0)",red,False,0.0,False
633,"sono ancora arrabbiato, a volte mi sento in colpa, ma so che è così un po’ per tutti.",sancire,"('red', 1, 0)",red,True,1.0,False
634,"Con mio marito non va bene niente. In 18 anni di matrimonio non abbiamo condiviso niente, ",sancire,"('red', 1, 0)",red,False,0.0,False
635,con la quale mantiene costanti contatti,sancire,"('red', 1, 0)",red,False,0.0,False
636,"sempre depresso, voglia di fare nulla, poca forza fisica, sempre stanco. Poca voglia di uscire e vedere a persone. Nessuna speranza per il futuro.",sancire,"('red', 1, 0)",red,True,1.0,False
637,"Sempre il mio modo di vivere, legato alle convinzioni umane e religiose.",sancire,"('red', 1, 0)",red,True,1.0,False
638,sai Max i pedofili spesso sono impotenti,sancire,"('red', 1, 0)",red,False,0.0,False
639,scelta nella quale fu sostenuta dagli stessi genitori,sancire,"('red', 1, 0)",red,False,0.0,False
640,"se affiancato da colloqui volti alla responsabilizzazione e sviluppo di maggiori competenze genitoriali del sig. Bianchi ,",sancire,"('red', 1, 0)",red,False,0.0,False
641,"secondo l'operatore il percorso con l'ente SOPRoxi permette alle persone di cui si è parlato, di ricreare le condizioni per trovare un equilibrio individuale e sociale.",sancire,"('red', 1, 0)",red,True,1.0,False
642,"servizi segmentati, ogni ospedale è organizzato in maniera diversa! Ci sono servizi che si prendono in carico la ""patologia"" presunta e non la persona. Ogni ussl è organizzata e lavora in circuiti chiusi.
 Altre realtà come associazioni, strutture, come Villa Tigli",sancire,"('red', 1, 0)",red,False,0.0,False
643,"Sì, sul tipo di lavoro che svolge",sancire,"('red', 1, 0)",red,False,0.0,False
644,"Sicuramente il comune, le  associazioni no profit e tanti singoli cittadini",sancire,"('red', 1, 0)",red,False,0.0,False
645,"Sicuramente ci sono delle IMPLICAZIONE consapevoli, diciamo di cui c’è consapevolezza, cioè una persona che ha avuto interventi, che ha una cardiopatia congenita penso che arrivi, che non possa diciamo rimuovere il suo vissuto e annullarlo, disfarsene come una cosa passata; il fatto stesso che ci sono delle limitazioni, non so, nello sforzo fisico, nelle attività sportive, nel fare tutto quello che possono fare gli altri, diciamo nel non poter svolgere tutte le attività che fanno gli altri, se non sapendo che, diciamo, si arriva da qua fin qua, sicuramente queste sono IMPLICAZIONE che hanno anche un impatto psicologico,",sancire,"('red', 1, 0)",red,False,0.0,False
646,"Sforzi, prestazioni agonistiche. Sono le cose a cui tenevo e che intendo continuare a fare,",sancire,"('red', 1, 0)",red,False,0.0,False
647,più cosciente del proprio stato ma ancora bisognosa d'aiuto,contrapposizione,"('red', 6, 4)",red,True,1.0,False
648,poi ci sono depressioni e depressioni ma è una persona che si sente svalutata,contrapposizione,"('red', 6, 4)",red,False,0.0,False
649,"Possono togliere la vita , o ferire indelebilmente la anima , ma non hanno vinto lo stesso !!",contrapposizione,"('red', 6, 4)",red,False,0.0,False
650,"Premesso che son sempre stato indipendente e orgoglioso, fatico a chiedere l'aiuto altrui. Però credo i parenti più stretti, la moglie, il figlio",contrapposizione,"('red', 6, 4)",red,False,0.0,False
651,"Pensavo di non aver commesso alcun reato. Avevo solo bestemmiato. Non pensavo mi arrestassero. Poi ho scoperto che i miei reati, e pure tanti, erano precedenti a quel giorno. ",contrapposizione,"('red', 6, 4)",red,False,0.0,False
652,"Probabilmente, nonostante i miglioramenti raggiunti fino a oggi, ha ancora bisogno di essere seguito in un contesto terapeutico tale che gli permetta di continuare il percorso già precedentemente iniziato. ",contrapposizione,"('red', 6, 4)",red,True,1.0,False
653,Può essere a volte una persona normale come tante ma quando i valori non sono come dovrebbero essere è triste ,contrapposizione,"('red', 6, 4)",red,False,0.0,False
654,"Quando sono tornato al paese mio volevo poter fare le stesse cose che facevo per strada, ma è stato impossibile.",contrapposizione,"('red', 6, 4)",red,False,0.0,False
655,Le uniche cose che mi sono pesate sono state le visite e soprattutto l'imPOSSIBILITA di fare sport agonisticamente. Adesso però non mi dà più fastidio,contrapposizione,"('red', 6, 4)",red,False,0.0,False
656,"Lo farei ma se non posso, non posso.",contrapposizione,"('red', 6, 4)",red,False,0.0,False
657,lo so che mi lamento continuamente ma non riesco ad alzarmi dal letto,contrapposizione,"('red', 6, 4)",red,False,0.0,False
658,"lo studente ha una marea di nozioni su tantissimi ambiti diversi, ma non riesce a concretizzare questo sapere in applicazioni pratiche,",contrapposizione,"('red', 6, 4)",red,False,0.0,False
659,"ma gli impotenti… leccavano, penetravano con dita e unghie, a volte oggetti, strizzavano, e pretendevano rapporti orali e il tempo passava e il loro coso era morto e loro si sentivano umiliati e diventavano bruschi e violenti e magari smettevano di torturarti dopo 4 ore. e finalmente anche chi mi vendeva mi lasciava i polsi. ",contrapposizione,"('red', 6, 4)",red,False,0.0,False
660,ma spero di poter cambiarla in positivo visto che problemi di droga mi hanno accompagnato per tutta la vita.,contrapposizione,"('red', 6, 4)",red,False,0.0,False
661,"Le REMS sono delle residenze, degne sostitute di carceri ed OPG, istituzioni della violenza e della repressione, il più delle volte primitive e contenitive. Le REMS dovrebbero avere l'obiettivo non di contenere, ma di aprire. ",contrapposizione,"('red', 6, 4)",red,False,0.0,False
662,"La mia vita a quel tempo era spensierata, il mio tempo lo passavo tra la famiglia e gli amici, ma mai avrei pensato di finire dentro una REMS ",contrapposizione,"('red', 6, 4)",red,False,0.0,False
663,"Mah, più che altro, cioè, descrivere non saprei neanche io come descrivermi, cioè, ho avuto questo “problema” fin da bambino, quindi pensavo di fare, da bambino pensi di fare tante cose, dopo un po’ andando avanti col tempo ti rendi conto che, come hanno detto prima i miei, giocare a calcio, fare attività a livello agonistico non ho potuto più farle,",contrapposizione,"('red', 6, 4)",red,False,0.0,False
664,"mantenendo con il paziente un rapporto incostante ma significativo, anche se conflittuale",contrapposizione,"('red', 6, 4)",red,False,0.0,False
665,"Non riesco a ricordare tutto, nonostante da adulta abbia fatto anni di analisi, pregato, lavorato su me stessa. ",contrapposizione,"('red', 6, 4)",red,False,0.0,False
666,"Non si cercano solo soldati provetti kamikaze: lo Stato Islamico ha nuovi target e così pesca nella rete studenti universitari, ingegneri e medici con tendenze estremiste cominciando a dialogare con loro",contrapposizione,"('red', 6, 4)",red,False,0.0,False
667,"Nonostante da anni ha normalizzato la propria vita, ancora vive i disagi dei suoi precedenti penali. ",contrapposizione,"('red', 6, 4)",red,True,1.0,False
668,mi faccio tutto ma con fatica,contrapposizione,"('red', 6, 4)",red,True,1.0,False
669,Mi spiace vedere che ci sono persone che cercano di difendere l’integrità morale di una persona che ha abusato di piccoli innocenti anzichè aprire gli occhi e decidere che non vale la pena sprecare tempo a difendere soggetti che si sono macchiati di tali abonimi.,contrapposizione,"('red', 6, 4)",red,False,0.0,False
670,"Nel mese di aprile del ’98 viene inserito nel Centro Diurno Terapeutico “xxx”, ma lo frequenta per circa nove mesi in modo discontinuo, manifestando scarso interesse e difficoltà a stare in quel particolare contesto.",contrapposizione,"('red', 6, 4)",red,True,1.0,False
671,"si aspetterebbero che la persona avesse trovato un po' di serenità e di equilibrio, ma rimarrebbero sciettici.",contrapposizione,"('red', 6, 4)",red,True,1.0,False
672,Cercando di impegnarmi almeno con un lavoro e una vita regolare,dichiarazione di intenti,"('red', 5, 4)",red,False,0.0,False
673,"Cercare di essere disponibile e stare insieme agli altri, condividendo le cose e giocare insieme.",dichiarazione di intenti,"('red', 5, 4)",red,True,1.0,False
674,"Cerca di riportare al benessere, ridimensionare o mantenere quanto piu possibile statiche alcune problematiche personali psicobiologiche e a volte anche sociofamiliari.",dichiarazione di intenti,"('red', 5, 4)",red,True,1.0,False
675,cerca di migliorarla apportando modifiche o di stabilizzarla qualora sia quella la necessità,dichiarazione di intenti,"('red', 5, 4)",red,False,0.0,False
676,"e cercherei di fare il possibile per trovare qualsiasi soluzione possibile per questo problema,",dichiarazione di intenti,"('red', 5, 4)",red,False,0.0,False
677,"e la prosecuzione della permanenza presso il Centro, soprattutto per assicurare loro un sostegno a livello scolastico, di F. e R., ",dichiarazione di intenti,"('red', 5, 4)",red,True,1.0,False
678,"Tutt'ora penso che avrei tanto bisogno di affetto, mia mamma me lo ha dato ma io ho sempre avuto bisogno di mio papà e ho sempre avuto il pensiero di non avere un papà.",contrapposizione,"('red', 6, 4)",red,False,0.0,False
679,"Sicuramente si, la mia vita non sarebbe stata uguale se non ci fosse stato questo problema, ma con questo non voglio dire che vorrei una vita diversa.",contrapposizione,"('red', 6, 4)",red,False,0.0,False
680, in vista di un progetto che in un futuro potrà essere ridefinito anche sulla base di ulteriori sviluppi sul piano delle autonomie personali residue.,dichiarazione di intenti,"('red', 5, 4)",red,False,0.0,False
681,"adesso come adesso devo mettermi tranquilla: non avere disturbi da parte della famiglia.
 Il mio essere me stessa: elegante nei modi e raffinata nella dialettica.",dichiarazione di intenti,"('red', 5, 4)",red,False,0.0,False
682,"Vorrei tornare a lavorare, però non so.",contrapposizione,"('red', 6, 4)",red,False,0.0,False
683,"una persona che sta cercando lavoro in psicologia ma nel frattempo fa qualche lavoretto per mantenersi,",contrapposizione,"('red', 6, 4)",red,True,1.0,False
684,"sentirebbe il vuoto creato da questa morte che, a differenza di altre morti, porta dentro di sé proprio le domande cardine della sopravvivenza, sensi di colpa, shock, ecc. ",confronto,"('red', 6, 4)",red,False,0.0,False
685,Avrei potuto parlare. Ma l’unica persona con cui parlavo era lui. ,contrapposizione,"('red', 6, 4)",red,True,1.0,False
686,"Nel rapporto con l'assistente sociale, M. è passato da un atteggiamento di chiusura e difesa emotiva ad un comportamento di disponibilità al confronto e di maggiore collaborazione.",confronto,"('red', 6, 4)",red,False,0.0,False
687,Non fa più le cose che faceva una volta.,confronto,"('red', 6, 4)",red,False,0.0,False
688,"magari anche a lavoro, vedo che insomma, all’epoca anche a qualche collega che raccontavo, cioè sicuramente mi vedevano che, cioè, era una cosa grave e quindi come possono descrivere?, descrivono che…eeh, mi davano anche della pazza, quello sì, mi dicevano che, sì, che ho anche avuto queste risposte qua: pazza, nel senso che dicono “no, non…”…sì, dopo anche là dipende, trovi quello che ti dice “sei incosciente” e quello che ti dice “complimenti bravo”, ho anche avuto delle persone che mi hanno detto “complimenti, brava! Brava per quello che hai fatto e quello che fai”, quindi questo.",confronto,"('red', 6, 4)",red,False,0.0,False
689,"Mi sentivo non tanto convinto delle persone, un po' diffidente…
 man mano che passava il tempo meglio più convinto perché vedevo i risultati",confronto,"('red', 6, 4)",red,False,0.0,False
690,"Non so, poi…sul discorso della consapevolezza poi, della conoscenza, è un po’ difficile immaginare come…si, da fuori diciamo, è difficile capire come si vive un percorso a ostacoli e che dipende anche da quello che è l’iter, perché se è una serie di interventi, bambino piccolissimo, che poi tutto sommato a parte controlli, a parte cose varie, ma diciamo è in gran parte risolto è un conto, invece una situazione di limitazione grave e di impatto importante proprio nella vita di tutti i giorni, nelle comuni attività, avere una riserva funzionale molto labile, con magari episodi che ti ricordano pesantemente che non sei come gli altri, penso che sia, diciamo, che porti a una consapevolezza, diciamo, a ricordare il proprio vissuto come…il vissuto del proprio trattamento, ricordarlo in maniera differente insomma.",confronto,"('red', 6, 4)",red,True,1.0,False
691,più lucido e consapevole.,confronto,"('red', 6, 4)",red,False,0.0,False
692,"Nonostante tutto questo turbinio di sensazioni avvilenti e di emozioni affliggenti e non molto confortanti, c’è una grossa differenza rispetto a prima: ora ho una consapevolezza e, quindi, la POSSIBILITA di scegliere.",confronto,"('red', 6, 4)",red,False,0.0,False
693,"però dopo quando nasce, se è come me, ripeto ovviamente come ogni domanda, che non ha problemi insomma grossi, sarei molto tranquillo, tranquillo e infatti anch’io non gli avrei dato, per esempio un gioco in più che all’altro figlio che non ha problemi, l’avrei trattato normalmente. Se poi aveva, no com’è il verbo, avesse avuto un problema più grave comunque non l’avrei trattato meglio rispetto all’altro fratello o sorella, però comunque l’avrei sostenuto di più, l’avrei, ehm, fatto, gli avrei, non so il verbo, ehm, l’avrei reso come un bambino normale.",confronto,"('red', 6, 4)",red,False,0.0,False
694,"Gli obiettivi non sono quelli di trasformare le persone ma di cercare di reinserirle nella società attenuando sempre più i loro problemi, sia nel contesto sociale che in quello giudiziario.",contrapposizione,"('red', 6, 4)",red,False,0.0,False
695,"ed infatti gli € 1000,00 progettati in favore della signora, € 500,00 sono stati pagati a marzo/aprile 2009 (dopo 7/8 mesi) con dei Fondi per il Gas, ma in data xx/xx/2009 la proprietaria di casa già aveva intimato lo sfratto con notifica del Tribunale Ordinario di Roma del xx/xx/2009 e citata in udienza per il giorno xx/xx/2009. ",contrapposizione,"('red', 6, 4)",red,False,0.0,False
696,"Giuseppe si presenta al servizio con molta puntualità, ma allo stesso tempo è in uno stato confusionale, che si contrappone al suo forte senso di determinazione nel cambiamento.",contrapposizione,"('red', 6, 4)",red,True,1.0,False
